{
  "schema_version": "1.0.0",
  "issue_id": "ISS-####",
  "ai_id": "AI-####",
  "summary": "<issue summary>",
  "issue_type": "<type>",
  "severity": "medium",
  "status": "open",
  "owner": "<role>",
  "date_opened": "YYYY-MM-DD",
  "date_closed": null,
  "resolution": null,
  "governance_escalation": false,
  "last_updated": "YYYY-MM-DD"
}
